{
  "scenario_id": "demo-full-flow",
  "run_id": "lane1-smoke-001",
  "attempt_index": 1,
  "passed": true,
  "final_state": "completed",
  "metrics": {
    "exec_latency_ms": 6200,
    "face_detected_within_5s": true,
    "wrist_face_coverage_ratio": 0.78,
    "expression_motion_count": 3
  },
  "degradations": [
    "hybrid-lane1-placeholder-video",
    "hybrid-lane1-deterministic-tracks"
  ],
  "failure_reasons": []
}
